{
  "schema_version": "national-jurisprudence-coverage-v1",
  "epoch": {
    "epoch_id": "2026-09-01@2026-09-01",
    "topology_version": "2026-09-01",
    "cutoff_date": "2026-09-01"
  },
  "claims": [
    {
      "epoch_id": "2026-09-01@2026-09-01",
      "dimension": "collection",
      "numerator": 19,
      "denominator": 94,
      "measured_at": "2026-09-01",
      "notes": "Denominador institucional da topologia; nao representa cobertura temporal integral nem disponibilidade live.",
      "ratio": 0.20212765957446807
    },
    {
      "epoch_id": "2026-09-01@2026-09-01",
      "dimension": "authority",
      "numerator": 19,
      "denominator": 94,
      "measured_at": "2026-09-01",
      "notes": "Denominador institucional da topologia; nao representa cobertura temporal integral nem disponibilidade live.",
      "ratio": 0.20212765957446807
    },
    {
      "epoch_id": "2026-09-01@2026-09-01",
      "dimension": "branch",
      "numerator": 7,
      "denominator": 8,
      "measured_at": "2026-09-01",
      "notes": "Denominador institucional da topologia; nao representa cobertura temporal integral nem disponibilidade live.",
      "ratio": 0.875
    },
    {
      "epoch_id": "2026-09-01@2026-09-01",
      "dimension": "surface",
      "numerator": 19,
      "denominator": 94,
      "measured_at": "2026-09-01",
      "notes": "Denominador institucional da topologia; nao representa cobertura temporal integral nem disponibilidade live.",
      "ratio": 0.20212765957446807
    },
    {
      "epoch_id": "2026-09-01@2026-09-01",
      "dimension": "provider",
      "numerator": 21,
      "denominator": 85,
      "measured_at": "2026-09-01",
      "notes": "Denominador institucional da topologia; nao representa cobertura temporal integral nem disponibilidade live.",
      "ratio": 0.24705882352941178
    }
  ],
  "gaps": [
    {
      "collection_id": "collection:cnj:jurisprudence",
      "authority_id": "authority:cnj",
      "branch": "national_council",
      "status": "candidate",
      "reason": "authority_cataloged_without_implemented_provider"
    },
    {
      "collection_id": "collection:tjap:jurisprudence",
      "authority_id": "authority:tjap",
      "branch": "state",
      "status": "candidate",
      "reason": "authority_cataloged_without_implemented_provider"
    },
    {
      "collection_id": "collection:tjce:jurisprudence",
      "authority_id": "authority:tjce",
      "branch": "state",
      "status": "candidate",
      "reason": "authority_cataloged_without_implemented_provider"
    },
    {
      "collection_id": "collection:tjes:jurisprudence",
      "authority_id": "authority:tjes",
      "branch": "state",
      "status": "candidate",
      "reason": "authority_cataloged_without_implemented_provider"
    },
    {
      "collection_id": "collection:tjma:jurisprudence",
      "authority_id": "authority:tjma",
      "branch": "state",
      "status": "candidate",
      "reason": "authority_cataloged_without_implemented_provider"
    },
    {
      "collection_id": "collection:tjmg:jurisprudence",
      "authority_id": "authority:tjmg",
      "branch": "state",
      "status": "candidate",
      "reason": "authority_cataloged_without_implemented_provider"
    },
    {
      "collection_id": "collection:tjmmg:jurisprudence",
      "authority_id": "authority:tjmmg",
      "branch": "military",
      "status": "candidate",
      "reason": "authority_cataloged_without_implemented_provider"
    },
    {
      "collection_id": "collection:tjmrs:jurisprudence",
      "authority_id": "authority:tjmrs",
      "branch": "military",
      "status": "candidate",
      "reason": "authority_cataloged_without_implemented_provider"
    },
    {
      "collection_id": "collection:tjmsp:jurisprudence",
      "authority_id": "authority:tjmsp",
      "branch": "military",
      "status": "candidate",
      "reason": "authority_cataloged_without_implemented_provider"
    },
    {
      "collection_id": "collection:tjmt:jurisprudence",
      "authority_id": "authority:tjmt",
      "branch": "state",
      "status": "candidate",
      "reason": "authority_cataloged_without_implemented_provider"
    },
    {
      "collection_id": "collection:tjpa:jurisprudence",
      "authority_id": "authority:tjpa",
      "branch": "state",
      "status": "candidate",
      "reason": "authority_cataloged_without_implemented_provider"
    },
    {
      "collection_id": "collection:tjpb:jurisprudence",
      "authority_id": "authority:tjpb",
      "branch": "state",
      "status": "candidate",
      "reason": "authority_cataloged_without_implemented_provider"
    },
    {
      "collection_id": "collection:tjpe:jurisprudence",
      "authority_id": "authority:tjpe",
      "branch": "state",
      "status": "candidate",
      "reason": "authority_cataloged_without_implemented_provider"
    },
    {
      "collection_id": "collection:tjpr:jurisprudence",
      "authority_id": "authority:tjpr",
      "branch": "state",
      "status": "candidate",
      "reason": "authority_cataloged_without_implemented_provider"
    },
    {
      "collection_id": "collection:tjrj:jurisprudence",
      "authority_id": "authority:tjrj",
      "branch": "state",
      "status": "candidate",
      "reason": "authority_cataloged_without_implemented_provider"
    },
    {
      "collection_id": "collection:tjrn:jurisprudence",
      "authority_id": "authority:tjrn",
      "branch": "state",
      "status": "candidate",
      "reason": "authority_cataloged_without_implemented_provider"
    },
    {
      "collection_id": "collection:tjro:jurisprudence",
      "authority_id": "authority:tjro",
      "branch": "state",
      "status": "candidate",
      "reason": "authority_cataloged_without_implemented_provider"
    },
    {
      "collection_id": "collection:tjrs:jurisprudence",
      "authority_id": "authority:tjrs",
      "branch": "state",
      "status": "candidate",
      "reason": "authority_cataloged_without_implemented_provider"
    },
    {
      "collection_id": "collection:tjsc:jurisprudence",
      "authority_id": "authority:tjsc",
      "branch": "state",
      "status": "candidate",
      "reason": "authority_cataloged_without_implemented_provider"
    },
    {
      "collection_id": "collection:tjse:jurisprudence",
      "authority_id": "authority:tjse",
      "branch": "state",
      "status": "candidate",
      "reason": "authority_cataloged_without_implemented_provider"
    },
    {
      "collection_id": "collection:tjto:jurisprudence",
      "authority_id": "authority:tjto",
      "branch": "state",
      "status": "candidate",
      "reason": "authority_cataloged_without_implemented_provider"
    },
    {
      "collection_id": "collection:treac:jurisprudence",
      "authority_id": "authority:treac",
      "branch": "electoral",
      "status": "candidate",
      "reason": "authority_cataloged_without_implemented_provider"
    },
    {
      "collection_id": "collection:treal:jurisprudence",
      "authority_id": "authority:treal",
      "branch": "electoral",
      "status": "candidate",
      "reason": "authority_cataloged_without_implemented_provider"
    },
    {
      "collection_id": "collection:tream:jurisprudence",
      "authority_id": "authority:tream",
      "branch": "electoral",
      "status": "candidate",
      "reason": "authority_cataloged_without_implemented_provider"
    },
    {
      "collection_id": "collection:treap:jurisprudence",
      "authority_id": "authority:treap",
      "branch": "electoral",
      "status": "candidate",
      "reason": "authority_cataloged_without_implemented_provider"
    },
    {
      "collection_id": "collection:treba:jurisprudence",
      "authority_id": "authority:treba",
      "branch": "electoral",
      "status": "candidate",
      "reason": "authority_cataloged_without_implemented_provider"
    },
    {
      "collection_id": "collection:trece:jurisprudence",
      "authority_id": "authority:trece",
      "branch": "electoral",
      "status": "candidate",
      "reason": "authority_cataloged_without_implemented_provider"
    },
    {
      "collection_id": "collection:tredf:jurisprudence",
      "authority_id": "authority:tredf",
      "branch": "electoral",
      "status": "candidate",
      "reason": "authority_cataloged_without_implemented_provider"
    },
    {
      "collection_id": "collection:trees:jurisprudence",
      "authority_id": "authority:trees",
      "branch": "electoral",
      "status": "candidate",
      "reason": "authority_cataloged_without_implemented_provider"
    },
    {
      "collection_id": "collection:trego:jurisprudence",
      "authority_id": "authority:trego",
      "branch": "electoral",
      "status": "candidate",
      "reason": "authority_cataloged_without_implemented_provider"
    },
    {
      "collection_id": "collection:trema:jurisprudence",
      "authority_id": "authority:trema",
      "branch": "electoral",
      "status": "candidate",
      "reason": "authority_cataloged_without_implemented_provider"
    },
    {
      "collection_id": "collection:tremg:jurisprudence",
      "authority_id": "authority:tremg",
      "branch": "electoral",
      "status": "candidate",
      "reason": "authority_cataloged_without_implemented_provider"
    },
    {
      "collection_id": "collection:trems:jurisprudence",
      "authority_id": "authority:trems",
      "branch": "electoral",
      "status": "candidate",
      "reason": "authority_cataloged_without_implemented_provider"
    },
    {
      "collection_id": "collection:tremt:jurisprudence",
      "authority_id": "authority:tremt",
      "branch": "electoral",
      "status": "candidate",
      "reason": "authority_cataloged_without_implemented_provider"
    },
    {
      "collection_id": "collection:trepa:jurisprudence",
      "authority_id": "authority:trepa",
      "branch": "electoral",
      "status": "candidate",